index,url,valid,domain,title,description,image,published,archive,content,quote,language,keyword
https://orf.at/stories/3401515/,https://orf.at/stories/3401515/,0,orf.at,Erdbeben erschüttert die russischen Kurilen,,https://orf.at/mojo/1_4_1/storyserver//news/common/images/og-fallback-news.png,2025-08-03T06:25:30Z,,"Ein schweres Erdbeben hat die russische Inselgruppe Kurilen erschüttert. Die Stärke habe 6,7 betragen, teilte das Deutsche Geoforschungszentrum heute mit. Es hatte die Stärke zunächst mit 6,35 angege… [+333 chars]",,de,'Erdbeben'
https://www.nzz.ch/panorama/erdbeben-erschuettert-die-russischen-kurilen-inseln-ld.1896161,https://www.nzz.ch/panorama/erdbeben-erschuettert-die-russischen-kurilen-inseln-ld.1896161,0,www.nzz.ch,Erdbeben erschüttert die russischen Kurilen-Inseln,Im Osten Russlands bebte erneut der Boden vor der Küste. Das russische Ministerium für Katastrophenschutz warnt vor einem Tsunami auf der Halbinsel Kamtschatka.,"https://img.nzz.ch/2025/08/03/ca300bf4-0e8e-4b62-bf25-ba8b5a704c9b.jpg?width=1200&height=675&fit=bounds&quality=75&auto=webp&crop=3468,1951,x0,y177&wmark=nzz",2025-08-03T06:46:52Z,http://archive.md/20250803080559/https://www.nzz.ch/panorama/erdbeben-erschuettert-die-russischen-kurilen-inseln-ld.1896161,"yas. Ein Erdbeben der Stärke 6,7 hat am Sonntag die russischen Kurilen-Inseln erschüttert, wie Reuters berichtet.
Optimieren Sie Ihre Browsereinstellungen
NZZ.ch benötigt JavaScript für wichtige Fu… [+1070 chars]",,de,'Erdbeben'
https://orf.at/stories/3401537/,https://orf.at/stories/3401537/,0,orf.at,Zweiter Vulkan in Russland ausgebrochen,Wenige Tage nach dem schweren Erdbeben vor der Ostküste Russlands ist in der ostrussischen Region Kamtschatka ein seit mehreren hundert Jahren ruhender Vulkan erstmals wieder ausgebrochen. Auf von Staatsmedien veröffentlichten Bildern war am Sonntag eine Rauc…,https://ibs.orf.at/news?image=https%3A%2F%2Fassets.orf.at%2Fmims%2F2025%2F32%2F37%2Fcrops%2Fw%3D1200%2Ch%3D630%2Cq%3D75%2F2720947_master_1047737_ticker_vulkan_im.jpg%3Fs%3D5f940d02a3819d1bfa57b09ca5c628e6eb611b5b,2025-08-03T11:33:50Z,https://web.archive.org/web/20250803120829/https://orf.at/stories/3401537/,"Laut dem Vulkanismusprogramm der US-Forschungsinstitution Smithsonian war der Krascheninnikow zuletzt im Jahr 1550 aktiv. Olga Girina, die Leiterin des Instituts für Vulkanologie und Seismologie auf … [+3565 chars]",,de,'Erdbeben'
https://www.focus.de/politik/ausland/polit-erdbeben-im-baltikum-litauens-regierungschef-paluckas-tritt-zurueck_46cc5f61-1e3a-4d74-a275-8a163aad05f0.html,https://www.focus.de/politik/ausland/polit-erdbeben-im-baltikum-litauens-regierungschef-paluckas-tritt-zurueck_46cc5f61-1e3a-4d74-a275-8a163aad05f0.html,0,www.focus.de,Polit-Erdbeben im Baltikum: Litauens Regierungschef Paluckas tritt zurück,In Litauen endet eine wochenlange politische Hängepartie: Regierungschef Paluckas erklärt nach schweren Vorwürfen seinen Rücktritt. Die politische Instabilität im Land kommt zu einem denkbar ungünstigen Zeitpunkt.,https://quadro.burda-forward.de/ctf/becf8212-8c52-41b4-b036-6c077b349a38.5b5b9733-1973-4f06-ab5a-2850cb2a96b6.jpeg?im=RegionOfInterestCrop%3D%281200%2C630%29%2CregionOfInterest%3D%281298%2C788%29&hash=7a4c4c5533a6dddcb33f8d010fa1fb1b4ba2ccd3e9a5012cd68df22926454f0a,2025-08-04T09:20:35Z,,Litauens Regierungschef Gintautas Paluckas und sein Kabinett sind zurückgetreten. Der 45 Jahre alte Sozialdemokrat zog damit die Konsequenzen aus Vorwürfen wegen dubioser Geschäftsbeziehungen und Int… [+1608 chars],,de,'Erdbeben'
https://www.tagesspiegel.de/internationales/new-york-times-bericht-russische-atom-u-boot-basis-in-kamtschatka-offenbar-nach-erdbeben-beschadigt-14132471.html,https://www.tagesspiegel.de/internationales/new-york-times-bericht-russische-atom-u-boot-basis-in-kamtschatka-offenbar-nach-erdbeben-beschadigt-14132471.html,0,www.tagesspiegel.de,„New York Times“-Bericht: Russische Atom-U-Boot-Basis in Kamtschatka offenbar nach Erdbeben beschädigt,"Auf von der kommerziellen Satellitenbildfirma Planet Labs aufgenommenen Fotos sei eine Beschädigung an einem schwimmenden Pier des Stützpunktes Rybachiy auf der Halbinsel Kamtschatka zu erkennen gewesen, hieß es in dem Bericht.",https://www.tagesspiegel.de/images/14132474/alternates/BASE_16_9_W1400/1754367423000/russia-kamchatka-earthquake.jpeg,2025-08-05T04:17:28Z,,In Russlands abgelegener Fernost-Region Kamtschatka ist einem Medienbericht zufolge nach dem starken Erdbeben in der vergangenen Woche offenbar ein Atom-U-Boot-Stützpunkt beschädigt worden. Das beric… [+1215 chars],,de,'Erdbeben'
https://www.focus.de/politik/ausland/satellitenbilder-enthuellen-so-stark-beschaedigte-erdbeben-russlands-atom-hafen_506e4994-405d-405f-9835-77a6967282a4.html,https://www.focus.de/politik/ausland/satellitenbilder-enthuellen-so-stark-beschaedigte-erdbeben-russlands-atom-hafen_506e4994-405d-405f-9835-77a6967282a4.html,0,www.focus.de,Satellitenbilder enthüllen: So stark beschädigte Erdbeben Russlands Atom-Hafen,"In der Nähe der Halbinsel Kamtschatka kam es in der vergangenen Woche zu einem starken Erdbeben. Satellitenbilder lassen nun erahnen, wie stark ein Stützpunkt der russischen Pazifikflotte betroffen sein könnte.",https://quadro.burda-forward.de/ctf/e2508fb5-9e10-464c-9a22-37584154f0c0.4e8d57d7-6423-49bc-ba45-6a3a69e3a0a7.png?im=RegionOfInterestCrop%3D%281200%2C630%29%2CregionOfInterest%3D%28588%2C441%29&hash=ddc94ebe445f6e125ff6d16c51aae49e1e8e6aafe2fef7909e9152fc6983bd3e,2025-08-06T10:01:05Z,,"Experten hatten bereits in der vergangenen Woche Alarm geschlagen. Nun gibt es Hinweise darauf, dass ein russischer Atom-U-Boot-Stützpunkt in der Region Kamtschatka durch das starke Erdbeben beschädi… [+1657 chars]",,de,'Erdbeben'
