index,url,valid,domain,title,description,image,published,archive,content,quote,language,keyword
https://www.sueddeutsche.de/panorama/philippinen-erdbeben-tote-schaden-li.3319992,https://www.sueddeutsche.de/panorama/philippinen-erdbeben-tote-schaden-li.3319992,0,www.sueddeutsche.de,Südostasien: Mindestens 22 Tote nach Erdbeben auf den Philippinen,Die Naturkatastrophe ereignete sich in der Region Visayas. Medien berichten von zahlreichen Verletzten. Zudem wurden zahlreiche Gebäude beschädigt und es kam zu Stromausfällen.,https://www.sueddeutsche.de/2025/10/01/fac74ee4-a674-47ef-86a9-daa3a9791e0d.jpg?q=60&fm=webp&width=1200&rect=0%2C146%2C2800%2C1575,2025-10-01T01:16:15Z,,"Der Vizebürgermeister der Stadt San Remigio, Alfie Reynes, bestätigte die Zahl von 22 Toten. Medienberichten zufolge sind mindestens 37 Menschen verletzt worden. Außerdem wurden Gebäude beschädigt, d… [+225 chars]",,de,'Erdbeben'
https://www.stern.de/panorama/staerke-6-9--mindestens-35-tote-bei-erdbeben-auf-den-philippinen-36095614.html,https://www.stern.de/panorama/staerke-6-9--mindestens-35-tote-bei-erdbeben-auf-den-philippinen-36095614.html,0,www.stern.de,"Stärke 6,9: Mindestens 35 Tote bei Erdbeben auf den Philippinen",Manila - Bei einem schweren Erdbeben sind auf den Philippinen Behördenangaben zufolge mindestens 35 Menschen gestorben. Mehrere Gebäude stürzten demnach,https://image.stern.de/36095616/t/Tg/v1/w1440/r1.7778/-/01--yhquiklj63v4axs2048jpeg---6dcda04e9e8d161b.jpg,2025-10-01T01:32:01Z,,"Kopiere den aktuellen Link
Zur Merkliste hinzufügen
Auf der südostasiatischen Inselgruppe bebt die Erde: Ein schweres Erdbeben kostet zahlreiche Menschen das Leben. Hunderte Nachbeben werden gemess… [+2024 chars]",,de,'Erdbeben'
https://www.tagesspiegel.de/gesellschaft/panorama/mindestens-69-tote-erdbeben-der-starke-69-erschuttert-die-philippinen-14433179.html,https://www.tagesspiegel.de/gesellschaft/panorama/mindestens-69-tote-erdbeben-der-starke-69-erschuttert-die-philippinen-14433179.html,0,www.tagesspiegel.de,"Mindestens 69 Tote: Erdbeben der Stärke 6,9 erschüttert die Philippinen","Panik, Erdrutsche und überall Trümmer: Auf den Philippinen bebt die Erde – und die Zahl der Toten steigt. Vor Krankenhäusern reihen sich Leichensäcke. Es gibt Vermisste.",https://www.tagesspiegel.de/images/14433692/alternates/BASE_16_9_W1400/1759298846000/search-and-rescue-underway-after-powerful-earthquake-struck-philippines.jpeg,2025-10-01T01:33:23Z,,"Naturkatastrophe auf den Philippinen: Ein schweres Erdbeben hat in dem südostasiatischen Inselstaat mindestens 69 Menschen das Leben gekostet. Die Zahl der Toten könnte aber weiter steigen, er hoffe … [+4948 chars]",,de,'Erdbeben Tote'
https://www.tagesspiegel.de/gesellschaft/panorama/starke-69-heftiges-erdbeben-auf-den-philippinen-mindestens-69-tote-14433179.html,https://www.tagesspiegel.de/gesellschaft/panorama/starke-69-heftiges-erdbeben-auf-den-philippinen-mindestens-69-tote-14433179.html,0,www.tagesspiegel.de,"Stärke 6,9: Heftiges Erdbeben auf den Philippinen: mindestens 69 Tote","Panik, Erdrutsche und überall Trümmer: Auf den Philippinen bebt die Erde - und die Zahl der Toten steigt. Vor Krankenhäusern reihen sich Leichensäcke.",https://www.tagesspiegel.de/images/14433596/alternates/BASE_16_9_W1400/1759297059000/starkes-erdbeben-vor-den-philippinen.jpeg,2025-10-01T01:33:23Z,,"Ein schweres Erdbeben hat auf den Philippinen mindestens 69 Menschen das Leben gekostet. Die Zahl der Toten könnte aber weiter steigen, er hoffe jedoch, dass sie im zweistelligen Bereich bleibe, sagt… [+4135 chars]",,de,'Erdbeben Tote'
https://www.tagesspiegel.de/gesellschaft/panorama/starke-69-schweres-erdbeben-auf-den-philippinen-mindestens-60-tote-14433179.html,https://www.tagesspiegel.de/gesellschaft/panorama/starke-69-schweres-erdbeben-auf-den-philippinen-mindestens-60-tote-14433179.html,0,www.tagesspiegel.de,"Stärke 6,9: Schweres Erdbeben auf den Philippinen: mindestens 60 Tote","Auf den Philippinen bebt die Erde heftig, es folgen Hunderte Nachbeben. Die Schäden sind groß - und die Zahl der Toten steigt.",https://www.tagesspiegel.de/images/14433389/alternates/BASE_16_9_W1400/1759290000000/starkes-erdbeben-vor-den-philippinen.jpeg,2025-10-01T01:33:23Z,,"Bei einem schweren Erdbeben sind auf den Philippinen mindestens 60 Menschen ums Leben gekommen. Die Zahl der Toten könnte aber noch deutlich steigen, sagte Bernardo Rafaelito Alejandro IV vom Zivilsc… [+3114 chars]",,de,'Erdbeben'
https://www.faz.net/aktuell/gesellschaft/ungluecke/mindestens-35-tote-bei-erdbeben-auf-den-philippinen-accg-110711749.html,https://www.faz.net/aktuell/gesellschaft/ungluecke/mindestens-35-tote-bei-erdbeben-auf-den-philippinen-accg-110711749.html,0,www.faz.net,Provinz Cebu: Mindestens 35 Tote bei Erdbeben auf den Philippinen,Ein schweres Erdbeben hat auf der südostasiatischen Inselgruppe zahlreiche Menschen das Leben gekostet. Handyvideos zeigten verstörende Szenen. Hunderte Nachbeben wurden gemessen.,https://media1.faz.net/ppmedia/w1200/aktuell/gesellschaft/3455674804/1.10711753/facebook_teaser/eine-beschaedigte-mcdonald-s.jpg.webp,2025-10-01T02:36:10Z,,Bei einem schweren Erdbeben sind auf den Philippinen Behördenangaben zufolge mindestens 35 Menschen gestorben. Mehrere Gebäude stürzten demnach ein und die Stromversorgung wurde unterbrochen. Mehr al… [+1793 chars],,de,'schweres Erdbeben'
https://www.n-tv.de/panorama/Schweres-Erdbeben-erschuettert-Philippinen-article26067527.html,https://www.n-tv.de/panorama/Schweres-Erdbeben-erschuettert-Philippinen-article26067527.html,0,www.n-tv.de,Behörden melden 35 Todesopfer: Schweres Erdbeben erschüttert Philippinen,"Ein Erdbeben der Stärke 6,9 kostet zahlreiche Menschen auf den Philippinen das Leben. Hunderte Nachbeben werden gemessen. Am Vorabend erreicht bereits eine Tsunami-Warnung die Menschen.",https://www.n-tv.de/img/incoming/crop26067534/906132126-cImg_16_9-w1200/550241864.jpg,2025-10-01T03:18:27Z,,"Ein Erdbeben der Stärke 6,9 kostet zahlreiche Menschen auf den Philippinen das Leben. Hunderte Nachbeben werden gemessen. Am Vorabend erreicht bereits eine Tsunami-Warnung die Menschen. 
Bei einem s… [+1998 chars]",,de,'Erdbeben'
https://www.stern.de/panorama/staerke-6-9--schweres-erdbeben-auf-den-philippinen--mindestens-60-tote-36095614.html,https://www.stern.de/panorama/staerke-6-9--schweres-erdbeben-auf-den-philippinen--mindestens-60-tote-36095614.html,0,www.stern.de,"Stärke 6,9: Schweres Erdbeben auf den Philippinen: mindestens 60 Tote",Manila - Bei einem schweren Erdbeben sind auf den Philippinen mindestens 60 Menschen ums Leben gekommen. Die Zahl der Toten könnte aber noch deutlich,https://image.stern.de/36095880/t/Gd/v1/w1440/r1.7778/-/01--ltvsrbcxkcv4axs2048jpeg---62d73a42fdab8b14.jpg,2025-10-01T03:38:32Z,,"Kopiere den aktuellen Link
Zur Merkliste hinzufügen
Auf den Philippinen bebt die Erde heftig, es folgen Hunderte Nachbeben. Die Schäden sind groß - und die Zahl der Toten steigt.
Bei einem schwere… [+2540 chars]",,de,'Erdbeben'
https://www.diepresse.com/20156221/schweres-erdbeben-auf-den-philippinen,https://www.diepresse.com/20156221/schweres-erdbeben-auf-den-philippinen,0,www.diepresse.com,Schweres Erdbeben auf den Philippinen,"Ein Beben der Stärke 6,9 hat die Philippinen erschüttert. Mindestens 60 Menschen sind gestorben. Die Zahl der Toten dürfte aber noch deutlich steigen.",https://img.diepresse.com/public/incoming/6b4wb8-TOPSHOT-PHILIPPINES-EARTHQUAKE/alternates/DPR_SOCIAL_NACHRICHTEN/TOPSHOT-PHILIPPINES-EARTHQUAKE,2025-10-01T04:49:41Z,,"Ein Beben der Stärke 6,9 hat die Philippinen erschüttert. Mindestens 60 Menschen sind gestorben. Die Zahl der Toten dürfte aber noch deutlich steigen.
Bei einem schweren Erdbeben auf den Philippinen… [+3236 chars]",,de,'schweres Erdbeben'
https://www.stern.de/panorama/staerke-6-9--heftiges-erdbeben-auf-den-philippinen--mindestens-69-tote-36095614.html,https://www.stern.de/panorama/staerke-6-9--heftiges-erdbeben-auf-den-philippinen--mindestens-69-tote-36095614.html,0,www.stern.de,"Stärke 6,9: Heftiges Erdbeben auf den Philippinen: mindestens 69 Tote","Panik, Erdrutsche und überall Trümmer: Auf den Philippinen bebt die Erde - und die Zahl der Toten steigt. Vor Krankenhäusern reihen sich Leichensäcke.",https://image.stern.de/36096040/t/A3/v1/w1440/r1.7778/-/01--bari5umh47v1axs2048jpeg---27668b363eb2afd3.jpg,2025-10-01T05:35:57Z,,"Kopiere den aktuellen Link
Zur Merkliste hinzufügen
Panik, Erdrutsche und überall Trümmer: Auf den Philippinen bebt die Erde - und die Zahl der Toten steigt. Vor Krankenhäusern reihen sich Leichens… [+3589 chars]",,de,'Erdbeben Tote'
https://www.faz.net/aktuell/gesellschaft/ungluecke/schweres-erdbeben-auf-den-philippinen-mindestens-69-tote-accg-110711749.html,https://www.faz.net/aktuell/gesellschaft/ungluecke/schweres-erdbeben-auf-den-philippinen-mindestens-69-tote-accg-110711749.html,0,www.faz.net,Zahl der Toten steigt: Mindestens 69 Tote bei Erdbeben auf den Philippinen,"Panik, Erdrutsche und überall Trümmer: Ein schweres Erdbeben kostet auf der südostasiatischen Inselgruppe zahlreiche Menschen das Leben. Handyvideos zeigten verstörende Szenen.",https://media1.faz.net/ppmedia/w1200/aktuell/gesellschaft/3455674804/1.10711753/facebook_teaser/eine-beschaedigte-mcdonald-s.jpg.webp,2025-10-01T05:52:10Z,,"Ein schweres Erdbeben hat auf den Philippinen mindestens 69 Menschen das Leben gekostet. Die Zahl der Toten könnte aber weiter steigen, er hoffe jedoch, dass sie im zweistelligen Bereich bleibe, sagt… [+3388 chars]",,de,'Erdbeben'
https://www.tagesschau.de/ausland/asien/erdbeben-philippinen-tote-100.html,https://www.tagesschau.de/ausland/asien/erdbeben-philippinen-tote-100.html,0,www.tagesschau.de,Viele Tote nach Erdbeben auf den Philippinen,"Nach einem starken Erdbeben vor den philippinischen Inseln sprechen die Behörden von mindestens 69 Todesopfern. Wie viele Menschen vermisst werden, ist noch unklar. Videos in sozialen Medien zeigen dramatische Szenen.",https://images.tagesschau.de/image/f470d502-b528-4f20-adcb-c8c7a6952b1f/AAABmZ5pv3M/AAABmKJZ-0g/16x9-big/erdbeben-philippinen-128.jpg?width=1280,2025-10-01T06:15:54Z,,"Stand: 01.10.2025 08:15 Uhr
Nach einem starken Erdbeben vor den philippinischen Inseln sprechen die Behörden von mindestens 69 Todesopfern. Wie viele Menschen vermisst werden, ist noch unklar. Video… [+4510 chars]",,de,'Erdbeben'
https://www.focus.de/panorama/mindestens-69-tote-nach-erdbeben-auf-den-philippinen-rettungskraefte-suchen-weiter_7af81a7a-9211-4f71-8718-bcde8c3c63f5.html,https://www.focus.de/panorama/mindestens-69-tote-nach-erdbeben-auf-den-philippinen-rettungskraefte-suchen-weiter_7af81a7a-9211-4f71-8718-bcde8c3c63f5.html,0,www.focus.de,Mindestens 69 Tote nach Erdbeben auf den Philippinen - Rettungskräfte suchen weiter,"Ein schweres Erdbeben der Stärke 6,9 hat die Philippinen erschüttert und mindestens 69 Menschen das Leben gekostet. Rettungsteams suchen weiter nach Überlebenden.",https://quadro.burda-forward.de/ctf/c7728f2d-c5b8-4e04-b84b-6af8908d0a53.c2871610-1969-430a-890a-a4efb15d7538.jpeg?im=RegionOfInterestCrop%3D%281200%2C630%29%2CregionOfInterest%3D%28606%2C437%29&hash=3a36c64784cded14094c8609173a53570032e54b5e0a92f965085a1af66fde96,2025-10-01T06:41:17Z,,"Ein schweres Erdbeben hat auf den Philippinen mindestens 69 Menschen das Leben gekostet. Die Zahl der Toten könnte aber weiter steigen, er hoffe jedoch, dass sie im zweistelligen Bereich bleibe, sagt… [+3133 chars]",,de,'Erdbeben Überlebende'
