index,url,valid,domain,title,description,image,published,archive,content,quote,language,keyword
https://www.zeit.de/2025-03/erdbeben-suedostasien-thailand-myanmar-naturkatastrophe-fs,https://www.zeit.de/2025-03/erdbeben-suedostasien-thailand-myanmar-naturkatastrophe-fs,0,www.zeit.de,Myanmar und Thailand: Eine Katastrophe mit unabsehbarem Ausmaß,"Zerstörung, Verletzte, Tote: Ein heftiges Erdbeben hat Thailand und besonders das vom Bürgerkrieg gezeichnete Myanmar getroffen. Erste Eindrücke aus der Krisenregion",https://img.zeit.de/wissen/2025-03/erdbeben-suedostasien-thailand-myanmar-naturkatastrophe-fs-bild/wide__1300x731,2025-03-28T14:36:34Z,http://archive.md/20250329050836/https://www.zeit.de/2025-03/erdbeben-suedostasien-thailand-myanmar-naturkatastrophe-fs,"Ein schweres Erdbeben sowie mehrere Nachbeben haben Südostasien und insbesondere Myanmar und die thailändische Hauptstadt Bangkok erschüttert. Wissenschaftler geben die Stärke mit rund 7,7 am.
Das E… [+1127 chars]",,de,'Erdbeben'
https://www.n-tv.de/panorama/Myanmar-meldet-144-Tote-und-732-Verletzte-durch-Erdbeben-article25664271.html,https://www.n-tv.de/panorama/Myanmar-meldet-144-Tote-und-732-Verletzte-durch-Erdbeben-article25664271.html,0,www.n-tv.de,"""Jedes Land"" um Hilfe gebeten: Myanmar meldet 144 Tote und 732 Verletzte durch Erdbeben",Das heftige Erdbeben in Myanmar und den angrenzenden Ländern sorgt für Hunderte Opfer. Aus der Gegend des Epizentrums wird bereits eine dreistellige Anzahl an Toten gemeldet. In Bangkok werden nur wenige Menschen für tot erklärt.,https://www.n-tv.de/img/incoming/crop25664276/1171323736-cImg_16_9-w1200/imago807874897.jpg,2025-03-28T14:47:02Z,,Das heftige Erdbeben in Myanmar und den angrenzenden Ländern sorgt für Hunderte Opfer. Aus der Gegend des Epizentrums wird bereits eine dreistellige Anzahl an Toten gemeldet. In Bangkok werden nur we… [+1166 chars],,de,'Erdbeben Verletzte'
https://www.diepresse.com/19520888/erdbeben-erschuettert-thailand-und-burma-mindestens-144-tote-bestaetigt-rotes-kreuz-befuerchtet-tausende-opfer,https://www.diepresse.com/19520888/erdbeben-erschuettert-thailand-und-burma-mindestens-144-tote-bestaetigt-rotes-kreuz-befuerchtet-tausende-opfer,0,www.diepresse.com,"Erdbeben erschüttert Thailand und Burma: Mindestens 144 Tote bestätigt, Rotes Kreuz befürchtet Tausende Opfer","Das Beben der Stärke 7,7 hat in weiten Teilen Südostasiens Verwüstungen angerichtet. In Bangkok stürzt ein im Bau befindliches Hochhaus ein und begräbt Dutzende Arbeiter unter sich, es gibt mehrere Tote. Aber vor allem in Burma, wo das Epizentrum liegt, sind …",https://img.diepresse.com/public/incoming/x0mhaa-MYANMAR-QUAKETHAILAND/alternates/DPR_SOCIAL_NACHRICHTEN/MYANMAR-QUAKETHAILAND,2025-03-28T14:51:59Z,,"Das Beben der Stärke 7,7 hat in weiten Teilen Südostasiens Verwüstungen angerichtet. In Bangkok stürzt ein im Bau befindliches Hochhaus ein und begräbt Dutzende Arbeiter unter sich, es gibt mehrere T… [+6865 chars]",,de,'Erdbeben Epizentrum'
https://www.welt.de/vermischtes/article255808266/Myanmar-und-Thailand-Schweres-Erdbeben-der-Staerke-7-7-mehr-als-150-Tote.html,https://www.welt.de/vermischtes/article255808266/Myanmar-und-Thailand-Schweres-Erdbeben-der-Staerke-7-7-mehr-als-150-Tote.html,0,www.welt.de,Schweres Erdbeben erschüttert Myanmar und Thailand – mehr als 150 Tote,"Ein schweres Erdbeben der Stärke 7,7 hat Südostasien erschüttert. Das Epizentrum des Bebens lag in Myanmar, aber auch in Bangkok kam es zu Schäden. Während die Rettungsarbeiten laufen, gibt es Angst vor möglichen Nachbeben.",https://img.welt.de/img/vermischtes/mobile255812940/9107930707-ci16x9-w1200/TOPSHOT-This-frame-grab-from-UGC.jpg,2025-03-28T14:52:00Z,,"Ein schweres Erdbeben der Stärke 7,7 hat Südostasien erschüttert. Das Epizentrum des Bebens lag in Myanmar, aber auch in Bangkok kam es zu Schäden. Während die Rettungsarbeiten laufen, gibt es Angst … [+4837 chars]",,de,'Erdbeben Schäden'
https://www.stern.de/news/regierung--mindestens-144-tote-und-732-verletzte-durch-erdbeben-in-myanmar-35594294.html,https://www.stern.de/news/regierung--mindestens-144-tote-und-732-verletzte-durch-erdbeben-in-myanmar-35594294.html,0,www.stern.de,Regierung: Mindestens 144 Tote und 732 Verletzte durch Erdbeben in Myanmar,"Bei dem schweren Erdbeben in Myanmar sind nach vorläufigen Regierungsangaben mehr als 140 Menschen ums Leben gekommen und hunderte weitere verletzt worden. Bislang seien 144 Todesopfer sowie 732 Verletzte gezählt worden, sagte der Chef der Militärregierung de…",https://image.stern.de/35594296/t/yM/v1/w1440/r1.7778/-/28--erdbebenschaeden-im-myanmarischen-mandalay---b9cd56aa0ed11bb1.jpg,2025-03-28T14:54:37Z,,"Kopiere den aktuellen Link
Zur Merkliste hinzufügen
Bei dem schweren Erdbeben in Myanmar sind nach vorläufigen Regierungsangaben mehr als 140 Menschen ums Leben gekommen und hunderte weitere verlet… [+1132 chars]",,de,'Erdbeben Schäden'
https://www.nzz.ch/video/erdbeben-in-myanmar-ld.1877630,https://www.nzz.ch/video/erdbeben-in-myanmar-ld.1877630,0,www.nzz.ch,VIDEO - Erdbeben in Myanmar: Diese Videos zeigen das Ausmass der Katastrophe,"Ein Erdbeben der Stärke 7,7 hat das Bürgerkriegsland Myanmar sowie Thailand getroffen. Erste Bilder zeigen nun das Ausmass der Zerstörung. Die politische Lage in Myanmar erschwert die Berichterstattung wie auch die Hilfeleistung, erklärt unser Südostasien-Kor…","https://img.nzz.ch/2025/03/28/68ad7c03-ab67-420d-84eb-f5114ba67776.jpeg?width=1200&height=674&fit=bounds&quality=75&auto=webp&crop=1942,1092,x0,y91&wmark=nzz",2025-03-28T15:00:00Z,,"Am 28. März 2025 bebt die Erde in Myanmar, Thailand und China. Mehrere starke Erdbeben erschüttern die Region. Die Lage ist unübersichtlich, doch es werden viele Verletzte oder Tote befürchtet. Auch … [+2604 chars]",,de,'Erdbeben'
https://www.tagesschau.de/ausland/asien/erdbeben-thailand-myanmar-110.html,https://www.tagesschau.de/ausland/asien/erdbeben-thailand-myanmar-110.html,0,www.tagesschau.de,Bislang mehr als 140 Tote durch Erdbeben in Myanmar gemeldet,"Noch ist das Ausmaß der Schäden durch das Erdbeben in Myanmar und Thailand kaum einzuschätzen, ebenso die Zahl der Opfer. Bisher wurden in Myanmar mehr als 140 Tote verzeichnet. Aus anderen Ländern kommen Hilfsangebote.",https://images.tagesschau.de/image/dc683d93-2b4c-4f24-b3d1-3a850bd40266/AAABld06EK0/AAABkZLhkrw/16x9-1280/truemmer-haus-myanmar-100.jpg,2025-03-28T15:24:13Z,https://web.archive.org/web/20250328165723/https://www.tagesschau.de/ausland/asien/erdbeben-thailand-myanmar-110.html,"Stand: 28.03.2025 16:40 Uhr
Noch ist das Ausmaß der Schäden durch das Erdbeben in Myanmar und Thailand kaum einzuschätzen, ebenso die Zahl der Opfer. Bisher wurden in Myanmar mehr als 140 Tote verze… [+5935 chars]",,de,'Erdbeben'
https://www.stern.de/panorama/weltgeschehen/erdbeben-erschuettert-myanmar-und-thailand---tote-in-beiden-laendern-35592128.html,https://www.stern.de/panorama/weltgeschehen/erdbeben-erschuettert-myanmar-und-thailand---tote-in-beiden-laendern-35592128.html,0,www.stern.de,Asien: Erdbeben trifft Myanmar und Thailand – Tote in beiden Ländern,"Ein Erdbeben mit einer Stärke bis zu 7,7 hat Teile Asiens erschüttert. Aus Myanmar und Thailands werden Todesopfer gemeldet. Auch Bangkok ist betroffen.",https://image.stern.de/35592160/t/wM/v1/w1440/r1.7778/-/erdbeben-bangkok-menschen-auf-der-strasse.jpg,2025-03-28T15:44:00Z,,"Kopiere den aktuellen Link
Zur Merkliste hinzufügen
In Asien hat ein Erdbeben mit einer Stärke bis zu 7,7 Myanmar erschüttert. Auch in Thailands Hauptstadt Bangkok bebte die Erde.
Ein starkes Erdb… [+7957 chars]",,de,'Erdbeben'
